{
  "schema": "search.results/v1",
  "message_id": "01M47K8KZ82846ZBSV58VCFWB2",
  "produced_at": "2026-10-06T03:14:09Z",
  "producer": {
    "service": "web-search-perplexity",
    "version": "1.0.0",
    "job_id": "01M47K8B60RM3M56CMJWGZ9C6G"
  },
  "engine": "perplexity",
  "source_id": "7d2b0c4e-1f3a-4b5c-8d6e-9f0a1b2c3d4e",
  "keyword_ids": [
    "0cd402b6-9015-45f8-86b4-d90cc086d320"
  ],
  "client_ids": [
    "0b6b8c7e-2d1a-4e0f-9c3a-5f2d1e8a7b60"
  ],
  "query": {
    "text": "\"فايبر اكس\" العراق",
    "variant": "arabic_context",
    "lang": "ar",
    "country": "IQ",
    "request_id": "pplx-01J9QW7"
  },
  "result": {
    "rank": 3,
    "title": "فايبر اكس تطلق باقة جديدة في واسط",
    "url": "https://www.example-daily.iq/economy/2026/10/05/fiberx-wasit?utm_source=fb",
    "snippet": "أعلنت شركة فايبر اكس عن …",
    "date": "2026-10-05",
    "last_updated": "2026-10-05"
  },
  "canonical_url": "https://www.example-daily.iq/economy/2026/10/05/fiberx-wasit",
  "canonical_url_hash": "fab8520795a70dfe8cdae271a98f16d663794dab09ebcccb3a560660fd321664",
  "raw_ref": "raw/green/web/2026/10/06/web-search-perplexity/000003.jsonl.zst#17",
  "provenance": {
    "route": "green",
    "vendor": "perplexity",
    "service": "web-search-perplexity",
    "fetched_at": "2026-10-06T03:14:08Z"
  },
  "retention_class": "news_excerpt"
}
