{
  "schema": "search.results/v1",
  "message_id": "01M487CCJ0N4X7HT681Q02ER3Q",
  "produced_at": "2026-10-06T09:05:44Z",
  "producer": {
    "service": "web-gdelt-poller",
    "version": "1.0.0",
    "job_id": "01M487B1K0HD8T2YTQZB9XYNWZ"
  },
  "engine": "gdelt",
  "source_id": "7d2b0c4e-1f3a-4b5c-8d6e-9f0a1b2c3d4e",
  "keyword_ids": [
    "0cd402b6-9015-45f8-86b4-d90cc086d320"
  ],
  "client_ids": [
    "0b6b8c7e-2d1a-4e0f-9c3a-5f2d1e8a7b60"
  ],
  "query": {
    "text": "(\"FiberX\" OR \"فايبر اكس\" OR \"فايبر إكس\")",
    "variant": "or_group",
    "lang": null,
    "country": null,
    "request_id": null
  },
  "result": {
    "rank": 2,
    "title": "FiberX expands fibre network in southern Iraq",
    "url": "https://www.example-gulf-news.com/2026/10/05/fiberx-expands",
    "snippet": null,
    "date": "2026-10-05",
    "last_updated": null
  },
  "canonical_url": "https://www.example-gulf-news.com/2026/10/05/fiberx-expands",
  "canonical_url_hash": "19bddee118fdcfec35f1695139ff290fff8e9ac8e749c91a5db3e059a06ac0e7",
  "raw_ref": "raw/green/web/2026/10/06/web-gdelt-poller/000009.jsonl.zst#6",
  "provenance": {
    "route": "green",
    "vendor": "gdelt",
    "service": "web-gdelt-poller",
    "fetched_at": "2026-10-06T09:05:43Z"
  },
  "retention_class": "news_excerpt",
  "hints": {
    "domain": "example-gulf-news.com",
    "language": "English",
    "source_country": "United Arab Emirates"
  }
}
